{
  "aircraft": "F-15ESE",
  "displayName": "F-15E S4+",
  "emptyWeight": 38936,
  "maxTakeoffWeight": 81000,
  "internalFuel": 22588,
  "cmdsCapacity": 240,
  "chaffIncrement": 30,
  "flareIncrement": 15,
  "defaultChaff": 120,
  "defaultFlare": 60,
  "defaultJoker": 3000,
  "defaultBingo": 2000,
  "radios": [
    {
      "name": "COM 1",
      "description": "UHF Radio 1",
      "presetCount": 20,
      "min": 225,
      "max": 399.975,
      "step": 0.025
    },
    {
      "name": "COM 2",
      "description": "V/UHF Radio 2",
      "presetCount": 40,
      "min": 30,
      "max": 399.975,
      "step": 0.025
    }
  ],
  "guns": [
    {
      "name": "M-61",
      "capacity": 510,
      "shells": [
        {
          "name": "M61_20_HEIT_RED",
          "displayName": "20mm red tracer"
        },
        {
          "name": "M61_20_PGU28",
          "displayName": "PGU-28/B SAPHEI"
        }
      ],
      "mixes": [
        {
          "sequence": [
            "M61_20_HEIT_RED",
            "M61_20_PGU28",
            "M61_20_PGU28",
            "M61_20_PGU28",
            "M61_20_PGU28",
            "M61_20_HEIT_RED"
          ]
        }
      ]
    }
  ],
  "stations": [
    {
      "station": 1,
      "name": "2A",
      "munitions": [
        "{AIM-9L}",
        "{6CEB49FC-DED8-4DED-B053-E1F033FF72D3}",
        "{9BFD8C90-F7AE-4e90-833B-BFD0CED0E536}",
        "{AIM-9J}",
        "{C8E06185-7CD6-4C90-959F-044679E90751}",
        "{40EF17B7-F508-45de-8566-6FFECC0C1AB8}",
        "CATM-9M"
      ]
    },
    {
      "station": 2,
      "name": "2",
      "munitions": [
        "{BCE4E030-38E9-423E-98ED-24BE3DA87C32}",
        "{Mk82SNAKEYE}",
        "{Mk82AIR}",
        "{AB8B8299-F1CC-4359-89B5-2172E0CF4A5A}",
        "{Mk_84AIR_GP}",
        "{CBU-87}",
        "{5335D97A-35A5-4643-9D9B-026C75961E52}",
        "{ADD3FAE1-EBF6-4EF9-8EFC-B36B5DDF1E6B}",
        "{51F9AAE5-964F-4D21-83FB-502E3BFE5F8A}",
        "{DB769D48-67D7-42ED-A2BE-108D566C8B1E}",
        "{34759BBC-AF1E-4AEE-A581-498FF7A6EBCE}",
        "{GBU-31}",
        "{GBU-31V3B}",
        "{GBU-38}",
        "{GBU_54_V_1B}",
        "{AGM-154A}",
        "{BDU-50LD}",
        "{BDU-50HD}",
        "{BDU-50LGB}",
        "{Mk_84AIR_TP}",
        "MXU-648-TP",
        "{F15E_EXTTANK}",
        "{F15E_EXTTANK_EMPTY}"
      ]
    },
    {
      "station": 3,
      "name": "2B",
      "munitions": [
        "{AIM-9L}",
        "{6CEB49FC-DED8-4DED-B053-E1F033FF72D3}",
        "{9BFD8C90-F7AE-4e90-833B-BFD0CED0E536}",
        "{AIM-9J}",
        "{C8E06185-7CD6-4C90-959F-044679E90751}",
        "{40EF17B7-F508-45de-8566-6FFECC0C1AB8}",
        "CATM-9M"
      ]
    },
    {
      "station": 4,
      "name": "L-CFT",
      "munitions": [
        "{BCE4E030-38E9-423E-98ED-24BE3DA87C32}",
        "{Mk82SNAKEYE}",
        "{Mk82AIR}",
        "{AB8B8299-F1CC-4359-89B5-2172E0CF4A5A}",
        "{Mk_84AIR_GP}",
        "{CFT_L_MK82LD_x_2}",
        "{CFT_L_MK82LD_x_3}",
        "{CFT_L_MK82LD_x_6}",
        "{CFT_L_MK82SE_x_2}",
        "{CFT_L_MK82SE_x_3}",
        "{CFT_L_MK82SE_x_6}",
        "{CFT_L_MK82AR_x_2}",
        "{CFT_L_MK82AR_x_3}",
        "{CFT_L_MK82AR_x_6}",
        "{CFT_L_MK84LD_x_2}",
        "{CFT_L_MK84AR_x_2}",
        "{CFT_L_BLU107_x_3}",
        "{CFT_L_BLU107_x_6}",
        "{CFT_L_CBU_87_x_3}",
        "{CFT_L_CBU_87_x_6}",
        "{CFT_L_CBU_97_x_3}",
        "{CFT_L_CBU_97_x_6}",
        "{CFT_L_CBU_100_x_3}",
        "{CFT_L_CBU_100_x_6}",
        "{DB769D48-67D7-42ED-A2BE-108D566C8B1E}",
        "{CFT_L_GBU_12_x_2}",
        "{CFT_L_GBU_12_x_4}",
        "{51F9AAE5-964F-4D21-83FB-502E3BFE5F8A}",
        "{CFT_L_GBU_10_x_2}",
        "{34759BBC-AF1E-4AEE-A581-498FF7A6EBCE}",
        "{GBU-31}",
        "{GBU-31V3B}",
        "{CFT_L_GBU_31_x_2}",
        "{CFT_L_GBU_31V3B_x_2}",
        "{CFT_L_GBU_38_x_3}",
        "{CFT_L_GBU_54_x_3}",
        "{AGM-154A}",
        "{BDU-50LD}",
        "{BDU-50HD}",
        "{BDU-50LGB}",
        "{Mk_84AIR_TP}",
        "{CFT_L_BDU50LD_x_2}",
        "{CFT_L_BDU50LD_x_3}",
        "{CFT_L_BDU50LD_x_6}",
        "{CFT_L_BDU50HD_x_2}",
        "{CFT_L_BDU50HD_x_3}",
        "{CFT_L_BDU50HD_x_6}",
        "{CFT_L_BDU50LGB_x_2}",
        "{CFT_L_BDU50LGB_x_4}",
        "{CFT_L_BDU56AR_x_2}",
        "MXU-648-TP"
      ]
    },
    {
      "station": 5,
      "name": "3C",
      "munitions": [
        "{8D399DDA-FF81-4F14-904D-099B34FE7918}",
        "{AIM-7F}",
        "{AIM-7H}",
        "{C8E06185-7CD6-4C90-959F-044679E90751}",
        "{40EF17B7-F508-45de-8566-6FFECC0C1AB8}",
        "MXU-648-TP"
      ]
    },
    {
      "station": 6,
      "name": "4C",
      "munitions": [
        "{8D399DDA-FF81-4F14-904D-099B34FE7918}",
        "{AIM-7F}",
        "{AIM-7H}",
        "{C8E06185-7CD6-4C90-959F-044679E90751}",
        "{40EF17B7-F508-45de-8566-6FFECC0C1AB8}",
        "MXU-648-TP"
      ]
    },
    {
      "station": 7,
      "name": "TGP",
      "munitions": ["{F-15E_AAQ-14_LANTIRN}"]
    },
    {
      "station": 8,
      "name": "5",
      "munitions": [
        "{BCE4E030-38E9-423E-98ED-24BE3DA87C32}",
        "{Mk82SNAKEYE}",
        "{Mk82AIR}",
        "{AB8B8299-F1CC-4359-89B5-2172E0CF4A5A}",
        "{Mk_84AIR_GP}",
        "{CBU-87}",
        "{5335D97A-35A5-4643-9D9B-026C75961E52}",
        "{ADD3FAE1-EBF6-4EF9-8EFC-B36B5DDF1E6B}",
        "{51F9AAE5-964F-4D21-83FB-502E3BFE5F8A}",
        "{DB769D48-67D7-42ED-A2BE-108D566C8B1E}",
        "{34759BBC-AF1E-4AEE-A581-498FF7A6EBCE}",
        "{GBU-31}",
        "{GBU-31V3B}",
        "{GBU-38}",
        "{GBU_54_V_1B}",
        "{AGM-154A}",
        "{BDU-50LD}",
        "{BDU-50HD}",
        "{BDU-50LGB}",
        "{Mk_84AIR_TP}",
        "{AN_AXQ_14}",
        "MXU-648-TP",
        "{F15E_EXTTANK}",
        "{F15E_EXTTANK_EMPTY}"
      ]
    },
    {
      "station": 9,
      "name": "NVP",
      "munitions": ["{F-15E_AAQ-13_LANTIRN}"]
    },
    {
      "station": 10,
      "name": "6C",
      "munitions": [
        "{8D399DDA-FF81-4F14-904D-099B34FE7918}",
        "{AIM-7F}",
        "{AIM-7H}",
        "{C8E06185-7CD6-4C90-959F-044679E90751}",
        "{40EF17B7-F508-45de-8566-6FFECC0C1AB8}",
        "MXU-648-TP"
      ]
    },
    {
      "station": 11,
      "name": "7C",
      "munitions": [
        "{8D399DDA-FF81-4F14-904D-099B34FE7918}",
        "{AIM-7F}",
        "{AIM-7H}",
        "{C8E06185-7CD6-4C90-959F-044679E90751}",
        "{40EF17B7-F508-45de-8566-6FFECC0C1AB8}",
        "MXU-648-TP"
      ]
    },
    {
      "station": 12,
      "name": "R-CFT",
      "munitions": [
        "{BCE4E030-38E9-423E-98ED-24BE3DA87C32}",
        "{Mk82SNAKEYE}",
        "{Mk82AIR}",
        "{AB8B8299-F1CC-4359-89B5-2172E0CF4A5A}",
        "{Mk_84AIR_GP}",
        "{CFT_R_MK82LD_x_2}",
        "{CFT_R_MK82LD_x_3}",
        "{CFT_R_MK82LD_x_6}",
        "{CFT_R_MK82SE_x_2}",
        "{CFT_R_MK82SE_x_3}",
        "{CFT_R_MK82SE_x_6}",
        "{CFT_R_MK82AR_x_2}",
        "{CFT_R_MK82AR_x_3}",
        "{CFT_R_MK82AR_x_6}",
        "{CFT_R_BLU107_x_3}",
        "{CFT_R_BLU107_x_6}",
        "{CFT_R_MK84LD_x_2}",
        "{CFT_R_MK84AR_x_2}",
        "{CFT_R_CBU_87_x_3}",
        "{CFT_R_CBU_87_x_6}",
        "{CFT_R_CBU_97_x_3}",
        "{CFT_R_CBU_97_x_6}",
        "{CFT_R_CBU_100_x_3}",
        "{CFT_R_CBU_100_x_6}",
        "{DB769D48-67D7-42ED-A2BE-108D566C8B1E}",
        "{CFT_R_GBU_12_x_2}",
        "{CFT_R_GBU_12_x_4}",
        "{51F9AAE5-964F-4D21-83FB-502E3BFE5F8A}",
        "{CFT_R_GBU_10_x_2}",
        "{34759BBC-AF1E-4AEE-A581-498FF7A6EBCE}",
        "{GBU-31}",
        "{GBU-31V3B}",
        "{CFT_R_GBU_31_x_2}",
        "{CFT_R_GBU_31V3B_x_2}",
        "{CFT_R_GBU_38_x_3}",
        "{CFT_R_GBU_54_x_3}",
        "{AGM-154A}",
        "{BDU-50LD}",
        "{BDU-50HD}",
        "{BDU-50LGB}",
        "{Mk_84AIR_TP}",
        "{CFT_R_BDU50LD_x_2}",
        "{CFT_R_BDU50LD_x_3}",
        "{CFT_R_BDU50LD_x_6}",
        "{CFT_R_BDU50HD_x_2}",
        "{CFT_R_BDU50HD_x_3}",
        "{CFT_R_BDU50HD_x_6}",
        "{CFT_R_BDU50LGB_x_2}",
        "{CFT_R_BDU50LGB_x_4}",
        "{CFT_R_BDU56AR_x_2}",
        "MXU-648-TP"
      ]
    },
    {
      "station": 13,
      "name": "8A",
      "munitions": [
        "{AIM-9L}",
        "{6CEB49FC-DED8-4DED-B053-E1F033FF72D3}",
        "{9BFD8C90-F7AE-4e90-833B-BFD0CED0E536}",
        "{AIM-9J}",
        "{C8E06185-7CD6-4C90-959F-044679E90751}",
        "{40EF17B7-F508-45de-8566-6FFECC0C1AB8}",
        "CATM-9M"
      ]
    },
    {
      "station": 14,
      "name": "8",
      "munitions": [
        "{BCE4E030-38E9-423E-98ED-24BE3DA87C32}",
        "{Mk82SNAKEYE}",
        "{Mk82AIR}",
        "{AB8B8299-F1CC-4359-89B5-2172E0CF4A5A}",
        "{Mk_84AIR_GP}",
        "{CBU-87}",
        "{5335D97A-35A5-4643-9D9B-026C75961E52}",
        "{ADD3FAE1-EBF6-4EF9-8EFC-B36B5DDF1E6B}",
        "{51F9AAE5-964F-4D21-83FB-502E3BFE5F8A}",
        "{DB769D48-67D7-42ED-A2BE-108D566C8B1E}",
        "{34759BBC-AF1E-4AEE-A581-498FF7A6EBCE}",
        "{GBU-31}",
        "{GBU-31V3B}",
        "{GBU-38}",
        "{GBU_54_V_1B}",
        "{AGM-154A}",
        "{BDU-50LD}",
        "{BDU-50HD}",
        "{BDU-50LGB}",
        "{Mk_84AIR_TP}",
        "MXU-648-TP",
        "{F15E_EXTTANK}",
        "{F15E_EXTTANK_EMPTY}"
      ]
    },
    {
      "station": 15,
      "name": "8B",
      "munitions": [
        "{AIM-9L}",
        "{6CEB49FC-DED8-4DED-B053-E1F033FF72D3}",
        "{9BFD8C90-F7AE-4e90-833B-BFD0CED0E536}",
        "{AIM-9J}",
        "{C8E06185-7CD6-4C90-959F-044679E90751}",
        "{40EF17B7-F508-45de-8566-6FFECC0C1AB8}",
        "CATM-9M"
      ]
    }
  ],
  "ammoTypes": [
    "PGU-28/B SAPHEI High Explosive Armor Piercing PGU",
    "M56 HEI High Explosive Incendiary"
  ]
}
