{
  "aircraft": "MiG-29S",
  "displayName": "MiG-29S",
  "emptyWeight": 24740,
  "maxTakeoffWeight": 43431,
  "internalFuel": 7701,
  "cmdsCapacity": 60,
  "chaffIncrement": 30,
  "flareIncrement": 30,
  "defaultChaff": 30,
  "defaultFlare": 30,
  "defaultJoker": 3000,
  "defaultBingo": 2000,
  "radios": [],
  "guns": [
    {
      "name": "GSh-30-1",
      "capacity": 150,
      "shells": [
        {
          "name": "GSH301_30_HE",
          "displayName": "30mm HE"
        }
      ]
    }
  ],
  "stations": [
    {
      "station": 1,
      "name": "Station 1",
      "munitions": [
        "{682A481F-0CB5-4693-A382-D00DD4A156D7}",
        "{R_60}",
        "{FBC29BFE-3D24-4C64-B81D-941239D12249}",
        "{D3F65166-1AB8-490f-AF2F-2FB6E22568B1}",
        "{D3F65166-1AB8-490f-AF2F-2FB6E22568B2}",
        "{D3F65166-1AB8-490f-AF2F-2FB6E22568B3}",
        "{D3F65166-1AB8-490f-AF2F-2FB6E22568B4}",
        "{D3F65166-1AB8-490f-AF2F-2FB6E22568B5}",
        "{D3F65166-1AB8-490f-AF2F-2FB6E22568B6}",
        "{B4C01D60-A8A3-4237-BD72-CA7655BC0FE9}"
      ]
    },
    {
      "station": 2,
      "name": "Station 2",
      "munitions": [
        "{682A481F-0CB5-4693-A382-D00DD4A156D7}",
        "{R_60}",
        "{FBC29BFE-3D24-4C64-B81D-941239D12249}",
        "{D3F65166-1AB8-490f-AF2F-2FB6E22568B1}",
        "{D3F65166-1AB8-490f-AF2F-2FB6E22568B2}",
        "{D3F65166-1AB8-490f-AF2F-2FB6E22568B3}",
        "{D3F65166-1AB8-490f-AF2F-2FB6E22568B4}",
        "{D3F65166-1AB8-490f-AF2F-2FB6E22568B5}",
        "{D3F65166-1AB8-490f-AF2F-2FB6E22568B6}",
        "{35B698AC-9FEF-4EC4-AD29-484A0085F62B}",
        "{BD289E34-DF84-4C5E-9220-4B14C346E79D}",
        "{3C612111-C7AD-476E-8A8E-2485812F4E5C}",
        "{FAB_250_M62}",
        "{37DCC01E-9E02-432F-B61D-10C166CA2798}",
        "{4203753F-8198-4E85-9924-6F8FF679F9FF}",
        "{RBK_250_275_AO_1SCH}",
        "{D5435F26-F120-4FA3-9867-34ACE562EF1B}",
        "{7AEC222D-C523-425e-B714-719C0D1EB14D}",
        "{96A7F676-F956-404A-AD04-F33FB2C74884}",
        "{96A7F676-F956-404A-AD04-F33FB2C74881}",
        "{F72F47E5-C83A-4B85-96ED-D3E46671EE9A}",
        "{3858707D-F5D5-4bbb-BDD8-ABB0530EBC7C}",
        "B-8M1 - 20 S-8OFP2",
        "{3DFB7320-AB0E-11d7-9897-000476191836}",
        "{B4C01D60-A8A3-4237-BD72-CA7655BC0FE9}"
      ]
    },
    {
      "station": 3,
      "name": "Station 3",
      "munitions": [
        "{682A481F-0CB5-4693-A382-D00DD4A156D7}",
        "{R_60}",
        "{FBC29BFE-3D24-4C64-B81D-941239D12249}",
        "{D3F65166-1AB8-490f-AF2F-2FB6E22568B1}",
        "{D3F65166-1AB8-490f-AF2F-2FB6E22568B2}",
        "{D3F65166-1AB8-490f-AF2F-2FB6E22568B3}",
        "{D3F65166-1AB8-490f-AF2F-2FB6E22568B4}",
        "{D3F65166-1AB8-490f-AF2F-2FB6E22568B5}",
        "{D3F65166-1AB8-490f-AF2F-2FB6E22568B6}",
        "{35B698AC-9FEF-4EC4-AD29-484A0085F62B}",
        "{BD289E34-DF84-4C5E-9220-4B14C346E79D}",
        "{3C612111-C7AD-476E-8A8E-2485812F4E5C}",
        "{FAB_250_M62}",
        "{37DCC01E-9E02-432F-B61D-10C166CA2798}",
        "{4203753F-8198-4E85-9924-6F8FF679F9FF}",
        "{RBK_250_275_AO_1SCH}",
        "{D5435F26-F120-4FA3-9867-34ACE562EF1B}",
        "{7AEC222D-C523-425e-B714-719C0D1EB14D}",
        "{96A7F676-F956-404A-AD04-F33FB2C74884}",
        "{96A7F676-F956-404A-AD04-F33FB2C74881}",
        "{F72F47E5-C83A-4B85-96ED-D3E46671EE9A}",
        "{3858707D-F5D5-4bbb-BDD8-ABB0530EBC7C}",
        "B-8M1 - 20 S-8OFP2",
        "{3DFB7320-AB0E-11d7-9897-000476191836}",
        "{B4C01D60-A8A3-4237-BD72-CA7655BC0FE9}",
        "{9B25D316-0434-4954-868F-D51DB1A38DF0}",
        "{88DAC840-9F75-4531-8689-B46E64E42E53}",
        "{E8069896-8435-4B90-95C0-01A03AE6E400}",
        "{B79C379A-9E87-4E50-A1EE-7F7E29C2E87A}",
        "{C0FF4842-FBAC-11d5-9190-00A0249B6F00}"
      ]
    },
    {
      "station": 4,
      "name": "Station 4",
      "munitions": [
        "{2BEC576B-CDF5-4B7F-961F-B0FA4312B841}",
        "{D3F65166-1AB8-490f-AF2F-2FB6E22568B1}",
        "{D3F65166-1AB8-490f-AF2F-2FB6E22568B2}",
        "{D3F65166-1AB8-490f-AF2F-2FB6E22568B3}",
        "{D3F65166-1AB8-490f-AF2F-2FB6E22568B4}",
        "{D3F65166-1AB8-490f-AF2F-2FB6E22568B5}",
        "{D3F65166-1AB8-490f-AF2F-2FB6E22568B6}"
      ]
    },
    {
      "station": 5,
      "name": "Station 5",
      "munitions": [
        "{682A481F-0CB5-4693-A382-D00DD4A156D7}",
        "{R_60}",
        "{FBC29BFE-3D24-4C64-B81D-941239D12249}",
        "{D3F65166-1AB8-490f-AF2F-2FB6E22568B1}",
        "{D3F65166-1AB8-490f-AF2F-2FB6E22568B2}",
        "{D3F65166-1AB8-490f-AF2F-2FB6E22568B3}",
        "{D3F65166-1AB8-490f-AF2F-2FB6E22568B4}",
        "{D3F65166-1AB8-490f-AF2F-2FB6E22568B5}",
        "{D3F65166-1AB8-490f-AF2F-2FB6E22568B6}",
        "{9B25D316-0434-4954-868F-D51DB1A38DF0}",
        "{88DAC840-9F75-4531-8689-B46E64E42E53}",
        "{E8069896-8435-4B90-95C0-01A03AE6E400}",
        "{B79C379A-9E87-4E50-A1EE-7F7E29C2E87A}",
        "{C0FF4842-FBAC-11d5-9190-00A0249B6F00}"
      ]
    },
    {
      "station": 6,
      "name": "Station 6",
      "munitions": [
        "{682A481F-0CB5-4693-A382-D00DD4A156D7}",
        "{R_60}",
        "{FBC29BFE-3D24-4C64-B81D-941239D12249}",
        "{D3F65166-1AB8-490f-AF2F-2FB6E22568B1}",
        "{D3F65166-1AB8-490f-AF2F-2FB6E22568B2}",
        "{D3F65166-1AB8-490f-AF2F-2FB6E22568B3}",
        "{D3F65166-1AB8-490f-AF2F-2FB6E22568B4}",
        "{D3F65166-1AB8-490f-AF2F-2FB6E22568B5}",
        "{D3F65166-1AB8-490f-AF2F-2FB6E22568B6}",
        "{35B698AC-9FEF-4EC4-AD29-484A0085F62B}",
        "{BD289E34-DF84-4C5E-9220-4B14C346E79D}",
        "{3C612111-C7AD-476E-8A8E-2485812F4E5C}",
        "{FAB_250_M62}",
        "{37DCC01E-9E02-432F-B61D-10C166CA2798}",
        "{4203753F-8198-4E85-9924-6F8FF679F9FF}",
        "{RBK_250_275_AO_1SCH}",
        "{D5435F26-F120-4FA3-9867-34ACE562EF1B}",
        "{7AEC222D-C523-425e-B714-719C0D1EB14D}",
        "{96A7F676-F956-404A-AD04-F33FB2C74884}",
        "{96A7F676-F956-404A-AD04-F33FB2C74881}",
        "{F72F47E5-C83A-4B85-96ED-D3E46671EE9A}",
        "{3858707D-F5D5-4bbb-BDD8-ABB0530EBC7C}",
        "B-8M1 - 20 S-8OFP2",
        "{3DFB7320-AB0E-11d7-9897-000476191836}"
      ]
    },
    {
      "station": 7,
      "name": "Station 7",
      "munitions": [
        "{682A481F-0CB5-4693-A382-D00DD4A156D7}",
        "{R_60}",
        "{FBC29BFE-3D24-4C64-B81D-941239D12249}",
        "{D3F65166-1AB8-490f-AF2F-2FB6E22568B1}",
        "{D3F65166-1AB8-490f-AF2F-2FB6E22568B2}",
        "{D3F65166-1AB8-490f-AF2F-2FB6E22568B3}",
        "{D3F65166-1AB8-490f-AF2F-2FB6E22568B4}",
        "{D3F65166-1AB8-490f-AF2F-2FB6E22568B5}",
        "{D3F65166-1AB8-490f-AF2F-2FB6E22568B6}",
        "{B4C01D60-A8A3-4237-BD72-CA7655BC0FE9}"
      ]
    }
  ]
}
